productid,productname,productdescription
75542e38-563f-436f-adeb-f426f1dabb5c,Starfruit Explosion,This starfruit ice cream is out of this world!
288fd748-ad2b-4417-83b9-7aa5be9cff22,Tropical Mango,You know what they say... It takes two.  You.  And this ice cream.
80bab959-ef8b-4ae3-8bf2-e876d77277b6,French Vanilla,It's vanilla ice cream.
4c25613a-a3c2-4ef3-8e02-9c335eb23204,Truly Orange-inal,Made from concentrate.
65ab124a-9b2c-4294-a52d-18839364ef15,Durian Durian,Smells suspect but tastes... also suspect.
0f5a0fe8-4506-4332-969e-699a693334a8,Beer,Hey this isn't ice cream!